{
  "schema": "station/v1",
  "id": "es-tf-adeje",
  "name": "Adeje",
  "lat": 28.0786,
  "lon": -16.7371,
  "timezone": "Atlantic/Canary",
  "datum": {
    "reference": "LAT",
    "msl_offset_m": 1.313
  },
  "source": {
    "primary": {
      "dataset": "TICON-4",
      "station_id": "tenerife4tg-ten-esp-cmems",
      "station_name": "Tenerife",
      "lat": 28.04694,
      "lon": -16.71805,
      "distance_km": 3.986,
      "analysis_epoch": {
        "start": "2019-11-01",
        "end": "2025-03-10"
      },
      "license": "cc-by-nc-4.0"
    },
    "fallback": [
      {
        "dataset": "TICON-4",
        "station_id": "gomeratg-gom-esp-cmems",
        "station_name": "Gomera",
        "lat": 28.0,
        "lon": -17.0,
        "distance_km": 27.242,
        "analysis_epoch": {
          "start": "2007-01-01",
          "end": "2025-06-30"
        },
        "license": "cc-by-nc-4.0"
      },
      {
        "dataset": "TICON-4",
        "station_id": "tenerife3tg-ten-esp-cmems",
        "station_name": "Tenerife",
        "lat": 28.418301,
        "lon": -16.550501,
        "distance_km": 41.963,
        "analysis_epoch": {
          "start": "2019-11-02",
          "end": "2025-06-30"
        },
        "license": "cc-by-nc-4.0"
      }
    ],
    "dropped_constituents": [
      {
        "name": "3N2",
        "amplitude_m": 0.022607,
        "phase_deg": 240.6974
      },
      {
        "name": "MTM",
        "amplitude_m": 0.021189,
        "phase_deg": 159.0132
      },
      {
        "name": "MSQM",
        "amplitude_m": 0.02038,
        "phase_deg": 330.9875
      },
      {
        "name": "3L2",
        "amplitude_m": 0.012931,
        "phase_deg": 163.1635
      },
      {
        "name": "SGM",
        "amplitude_m": 0.006008,
        "phase_deg": 70.6776
      },
      {
        "name": "R3",
        "amplitude_m": 0.004902,
        "phase_deg": 155.6138
      },
      {
        "name": "2MO5",
        "amplitude_m": 0.00395,
        "phase_deg": 315.2866
      },
      {
        "name": "T3",
        "amplitude_m": 0.00325,
        "phase_deg": 282.3054
      },
      {
        "name": "S3",
        "amplitude_m": 0.003225,
        "phase_deg": 139.5383
      },
      {
        "name": "2MK5",
        "amplitude_m": 0.001709,
        "phase_deg": 78.158
      },
      {
        "name": "N4",
        "amplitude_m": 0.001207,
        "phase_deg": 293.5503
      }
    ],
    "derived_at": "2026-08-29T09:58:50Z",
    "attribution": [
      {
        "name": "TICON-4",
        "url": "https://www.seanoe.org/data/00980/109129/",
        "license": "cc-by-nc-4.0",
        "license_url": "https://creativecommons.org/licenses/by-nc/4.0/",
        "role": "constantes armónicas",
        "notes": "Upstream GESLA data provider restricts commercial use. See https://gesla787883612.wordpress.com/license/"
      },
      {
        "name": "openwatersio/tide-database",
        "url": "https://github.com/openwatersio/tide-database",
        "license": "MIT (código) · licencia de origen por estación (datos)",
        "license_url": "https://github.com/openwatersio/tide-database/blob/main/LICENSE",
        "role": "agregación y normalización · huella sha256 del contenido 2bbba2f45b8b4408…"
      },
      {
        "name": "GeoNames",
        "url": "https://www.geonames.org/",
        "license": "cc-by-4.0",
        "license_url": "https://creativecommons.org/licenses/by/4.0/",
        "role": "catálogo de puertos: nombre del municipio y coordenadas de la dársena · huella sha256 del volcado e2aa4fa9e6801568…"
      }
    ]
  },
  "constituents": [
    {
      "name": "M2",
      "amplitude_m": 0.57276,
      "phase_deg": 23.1596
    },
    {
      "name": "N2",
      "amplitude_m": 0.106031,
      "phase_deg": 4.1701
    },
    {
      "name": "S2",
      "amplitude_m": 0.238304,
      "phase_deg": 46.5207
    },
    {
      "name": "K2",
      "amplitude_m": 0.065493,
      "phase_deg": 41.2588
    },
    {
      "name": "2N2",
      "amplitude_m": 0.016813,
      "phase_deg": 359.1554
    },
    {
      "name": "S1",
      "amplitude_m": 0.030264,
      "phase_deg": 50.6879
    },
    {
      "name": "K1",
      "amplitude_m": 0.045178,
      "phase_deg": 33.5873
    },
    {
      "name": "P1",
      "amplitude_m": 0.013318,
      "phase_deg": 320.4128
    },
    {
      "name": "O1",
      "amplitude_m": 0.04418,
      "phase_deg": 296.5191
    },
    {
      "name": "Q1",
      "amplitude_m": 0.014004,
      "phase_deg": 245.3716
    },
    {
      "name": "M1",
      "amplitude_m": 0.007632,
      "phase_deg": 228.2907
    },
    {
      "name": "M4",
      "amplitude_m": 0.00577,
      "phase_deg": 69.3978
    },
    {
      "name": "MM",
      "amplitude_m": 0.009802,
      "phase_deg": 117.7479
    },
    {
      "name": "MF",
      "amplitude_m": 0.004863,
      "phase_deg": 12.5133
    },
    {
      "name": "SA",
      "amplitude_m": 0.193855,
      "phase_deg": 151.5965
    },
    {
      "name": "SSA",
      "amplitude_m": 0.13366,
      "phase_deg": 80.8167
    },
    {
      "name": "T2",
      "amplitude_m": 0.00717,
      "phase_deg": 81.6139
    },
    {
      "name": "J1",
      "amplitude_m": 0.001516,
      "phase_deg": 182.6806
    },
    {
      "name": "L2",
      "amplitude_m": 0.022442,
      "phase_deg": 15.124
    },
    {
      "name": "R2",
      "amplitude_m": 0.004038,
      "phase_deg": 64.5993
    },
    {
      "name": "2Q1",
      "amplitude_m": 0.004119,
      "phase_deg": 157.0792
    },
    {
      "name": "MSF",
      "amplitude_m": 0.017008,
      "phase_deg": 35.2645
    },
    {
      "name": "EP2",
      "amplitude_m": 0.004794,
      "phase_deg": 292.6276
    },
    {
      "name": "M3",
      "amplitude_m": 0.006078,
      "phase_deg": 159.3119
    },
    {
      "name": "MU2",
      "amplitude_m": 0.024201,
      "phase_deg": 345.1232
    },
    {
      "name": "NU2",
      "amplitude_m": 0.023772,
      "phase_deg": 12.3703
    },
    {
      "name": "LAM2",
      "amplitude_m": 0.004,
      "phase_deg": 40.1984
    },
    {
      "name": "MN4",
      "amplitude_m": 0.004565,
      "phase_deg": 64.3851
    },
    {
      "name": "MS4",
      "amplitude_m": 0.001969,
      "phase_deg": 109.8254
    },
    {
      "name": "MKS2",
      "amplitude_m": 0.01439,
      "phase_deg": 46.0596
    },
    {
      "name": "M6",
      "amplitude_m": 0.001706,
      "phase_deg": 344.617
    },
    {
      "name": "M8",
      "amplitude_m": 0.000162,
      "phase_deg": 297.9688
    },
    {
      "name": "S4",
      "amplitude_m": 0.005459,
      "phase_deg": 247.5642
    },
    {
      "name": "OO1",
      "amplitude_m": 0.00674,
      "phase_deg": 59.2233
    },
    {
      "name": "MA2",
      "amplitude_m": 0.037371,
      "phase_deg": 286.3181
    },
    {
      "name": "MB2",
      "amplitude_m": 0.036599,
      "phase_deg": 115.6457
    },
    {
      "name": "RHO",
      "amplitude_m": 0.000894,
      "phase_deg": 296.0401
    },
    {
      "name": "2SM2",
      "amplitude_m": 0.002424,
      "phase_deg": 211.7413
    },
    {
      "name": "2MS6",
      "amplitude_m": 0.001071,
      "phase_deg": 33.3189
    }
  ],
  "quality": {
    "rmse_m": null,
    "hw_time_err_p95_min": null,
    "grade": "C",
    "validated_against": "sin observación propia: la predicción no se ha comprobado en este puerto",
    "grade_reason": "no alcanza B: sin observaciones ni segunda fuente: no hay con qué validar",
    "estimated": true,
    "estimated_reason": "no hay observaciones de este puerto con las que comprobar la predicción: las constantes son las de `tenerife4tg-ten-esp-cmems`, en la propia dársena, pero nadie las ha contrastado aquí",
    "metrics": {
      "window_start": "2026-07-30T00:00:00Z",
      "window_days": 30.0,
      "samples": 0,
      "predicted_range_m": 2.1752,
      "rmse_m": null,
      "nrmse": null,
      "r2": null,
      "hw_time_err_p95_min": null,
      "hw_height_err_p95_m": null,
      "matched_extremes": 0,
      "predicted_extremes": 116,
      "predicted_extremes_in_window": 0,
      "observed_extremes": 0,
      "extremes_usable": false,
      "cross_rmse_m": null,
      "cross_source": null,
      "cross_rmse_worst_m": null,
      "cross_source_worst": null,
      "truncation_rms_m": 0.02972,
      "dropped_amplitude_m": 0.10136,
      "dropped_amplitude_fraction": 0.055213,
      "dropped_constituents": [
        "3N2",
        "MTM",
        "MSQM",
        "3L2",
        "SGM",
        "R3",
        "2MO5",
        "T3",
        "S3",
        "2MK5",
        "N4"
      ],
      "observation_source": null,
      "observation_code": null,
      "observation_distance_km": null,
      "observation_lat": null,
      "observation_lon": null
    }
  }
}
