{
  "schema": "station/v1",
  "id": "es-c-a-coruna",
  "name": "A Coruña",
  "lat": 43.3623,
  "lon": -8.3927,
  "timezone": "Europe/Madrid",
  "datum": {
    "reference": "LAT",
    "msl_offset_m": 2.149
  },
  "source": {
    "primary": {
      "dataset": "TICON-4",
      "station_id": "coruna-coru-esp-ieo",
      "station_name": "Coruna",
      "lat": 43.3683,
      "lon": -8.3977,
      "distance_km": 0.78,
      "analysis_epoch": {
        "start": "1997-12-31",
        "end": "2016-12-31"
      },
      "license": "cc-by-4.0"
    },
    "fallback": [
      {
        "dataset": "TICON-4",
        "station_id": "la_coruna-830-esp-uhslc_fd",
        "station_name": "La Coruna",
        "lat": 43.367,
        "lon": -8.4,
        "distance_km": 0.788,
        "analysis_epoch": {
          "start": "2005-03-20",
          "end": "2024-03-20"
        },
        "license": "cc-by-4.0"
      },
      {
        "dataset": "TICON-4",
        "station_id": "la_coruna-830a-esp-uhslc_rq",
        "station_name": "La Coruna",
        "lat": 43.367,
        "lon": -8.4,
        "distance_km": 0.788,
        "analysis_epoch": {
          "start": "1998-12-31",
          "end": "2017-12-31"
        },
        "license": "cc-by-4.0"
      },
      {
        "dataset": "TICON-4",
        "station_id": "corunatg-cor-esp-cmems",
        "station_name": "Coruna",
        "lat": 43.356998,
        "lon": -8.389,
        "distance_km": 0.661,
        "analysis_epoch": {
          "start": "2006-06-30",
          "end": "2025-06-30"
        },
        "license": "cc-by-nc-4.0"
      },
      {
        "dataset": "TICON-4",
        "station_id": "ferroltg-fer-esp-cmems",
        "station_name": "Ferrol",
        "lat": 43.463001,
        "lon": -8.326,
        "distance_km": 12.426,
        "analysis_epoch": {
          "start": "2007-01-01",
          "end": "2025-06-30"
        },
        "license": "cc-by-nc-4.0"
      },
      {
        "dataset": "TICON-4",
        "station_id": "ferrol2tg-fer-esp-cmems",
        "station_name": "Ferrol",
        "lat": 43.4762,
        "lon": -8.2485,
        "distance_km": 17.206,
        "analysis_epoch": {
          "start": "2007-01-01",
          "end": "2025-06-30"
        },
        "license": "cc-by-nc-4.0"
      },
      {
        "dataset": "TICON-4",
        "station_id": "langosteiratg-lan-esp-cmems",
        "station_name": "Langosteira",
        "lat": 43.3465,
        "lon": -8.5301,
        "distance_km": 11.247,
        "analysis_epoch": {
          "start": "2012-11-09",
          "end": "2025-06-30"
        },
        "license": "cc-by-nc-4.0"
      },
      {
        "dataset": "TICON-4",
        "station_id": "coruna2tg-cor-esp-cmems",
        "station_name": "Coruna",
        "lat": 43.364399,
        "lon": -8.3989,
        "distance_km": 0.553,
        "analysis_epoch": {
          "start": "2019-11-01",
          "end": "2024-06-04"
        },
        "license": "cc-by-nc-4.0"
      }
    ],
    "dropped_constituents": [
      {
        "name": "EP2",
        "amplitude_m": 0.009716,
        "phase_deg": 18.9802
      },
      {
        "name": "MA2",
        "amplitude_m": 0.007693,
        "phase_deg": 11.2951
      },
      {
        "name": "MB2",
        "amplitude_m": 0.005477,
        "phase_deg": 41.3233
      },
      {
        "name": "3L2",
        "amplitude_m": 0.005387,
        "phase_deg": 262.2681
      },
      {
        "name": "SGM",
        "amplitude_m": 0.003848,
        "phase_deg": 57.6468
      },
      {
        "name": "R3",
        "amplitude_m": 0.003161,
        "phase_deg": 289.3155
      },
      {
        "name": "MKS2",
        "amplitude_m": 0.00289,
        "phase_deg": 8.3803
      },
      {
        "name": "T3",
        "amplitude_m": 0.002792,
        "phase_deg": 102.8916
      },
      {
        "name": "MTM",
        "amplitude_m": 0.002695,
        "phase_deg": 202.1609
      },
      {
        "name": "2MS6",
        "amplitude_m": 0.001888,
        "phase_deg": 211.5813
      },
      {
        "name": "MSQM",
        "amplitude_m": 0.001863,
        "phase_deg": 260.8715
      },
      {
        "name": "N4",
        "amplitude_m": 0.001359,
        "phase_deg": 207.8856
      },
      {
        "name": "3N2",
        "amplitude_m": 0.000926,
        "phase_deg": 178.7315
      },
      {
        "name": "S3",
        "amplitude_m": 0.000844,
        "phase_deg": 125.8858
      },
      {
        "name": "2MO5",
        "amplitude_m": 0.000237,
        "phase_deg": 97.4768
      },
      {
        "name": "2MK5",
        "amplitude_m": 0.000181,
        "phase_deg": 2.6952
      }
    ],
    "derived_at": "2026-08-28T02:27:59Z",
    "attribution": [
      {
        "name": "TICON-4",
        "url": "https://www.seanoe.org/data/00980/109129/",
        "license": "cc-by-4.0",
        "license_url": "https://creativecommons.org/licenses/by/4.0/",
        "role": "constantes armónicas"
      },
      {
        "name": "openwatersio/tide-database",
        "url": "https://github.com/openwatersio/tide-database",
        "license": "MIT (código) · licencia de origen por estación (datos)",
        "license_url": "https://github.com/openwatersio/tide-database/blob/main/LICENSE",
        "role": "agregación y normalización · huella sha256 del contenido 2bbba2f45b8b4408…"
      }
    ]
  },
  "constituents": [
    {
      "name": "M2",
      "amplitude_m": 1.179668,
      "phase_deg": 86.1343
    },
    {
      "name": "N2",
      "amplitude_m": 0.248537,
      "phase_deg": 67.0695
    },
    {
      "name": "S2",
      "amplitude_m": 0.412879,
      "phase_deg": 116.3372
    },
    {
      "name": "K2",
      "amplitude_m": 0.116172,
      "phase_deg": 113.2081
    },
    {
      "name": "2N2",
      "amplitude_m": 0.035755,
      "phase_deg": 48.2456
    },
    {
      "name": "S1",
      "amplitude_m": 0.004798,
      "phase_deg": 46.9817
    },
    {
      "name": "K1",
      "amplitude_m": 0.072715,
      "phase_deg": 71.1333
    },
    {
      "name": "P1",
      "amplitude_m": 0.023453,
      "phase_deg": 60.4333
    },
    {
      "name": "O1",
      "amplitude_m": 0.066121,
      "phase_deg": 324.1884
    },
    {
      "name": "Q1",
      "amplitude_m": 0.020848,
      "phase_deg": 273.0559
    },
    {
      "name": "M1",
      "amplitude_m": 0.001823,
      "phase_deg": 329.871
    },
    {
      "name": "M4",
      "amplitude_m": 0.011649,
      "phase_deg": 290.7935
    },
    {
      "name": "MM",
      "amplitude_m": 0.002232,
      "phase_deg": 246.9165
    },
    {
      "name": "MF",
      "amplitude_m": 0.007726,
      "phase_deg": 191.6908
    },
    {
      "name": "SA",
      "amplitude_m": 0.041727,
      "phase_deg": 246.9836
    },
    {
      "name": "SSA",
      "amplitude_m": 0.025987,
      "phase_deg": 91.4087
    },
    {
      "name": "T2",
      "amplitude_m": 0.021691,
      "phase_deg": 109.2515
    },
    {
      "name": "J1",
      "amplitude_m": 0.002584,
      "phase_deg": 103.0434
    },
    {
      "name": "L2",
      "amplitude_m": 0.026715,
      "phase_deg": 100.4691
    },
    {
      "name": "R2",
      "amplitude_m": 0.002292,
      "phase_deg": 127.2724
    },
    {
      "name": "2Q1",
      "amplitude_m": 0.003795,
      "phase_deg": 222.797
    },
    {
      "name": "MSF",
      "amplitude_m": 0.005032,
      "phase_deg": 95.0681
    },
    {
      "name": "M3",
      "amplitude_m": 0.009147,
      "phase_deg": 317.8706
    },
    {
      "name": "MU2",
      "amplitude_m": 0.041218,
      "phase_deg": 44.2415
    },
    {
      "name": "NU2",
      "amplitude_m": 0.048056,
      "phase_deg": 70.5064
    },
    {
      "name": "LAM2",
      "amplitude_m": 0.007277,
      "phase_deg": 89.5126
    },
    {
      "name": "MN4",
      "amplitude_m": 0.005461,
      "phase_deg": 251.2425
    },
    {
      "name": "MS4",
      "amplitude_m": 0.005675,
      "phase_deg": 2.6164
    },
    {
      "name": "M6",
      "amplitude_m": 0.001679,
      "phase_deg": 138.6593
    },
    {
      "name": "M8",
      "amplitude_m": 0.000316,
      "phase_deg": 253.7178
    },
    {
      "name": "S4",
      "amplitude_m": 0.000655,
      "phase_deg": 77.9841
    },
    {
      "name": "OO1",
      "amplitude_m": 0.001145,
      "phase_deg": 209.6849
    },
    {
      "name": "RHO",
      "amplitude_m": 0.003987,
      "phase_deg": 278.2708
    },
    {
      "name": "2SM2",
      "amplitude_m": 0.000992,
      "phase_deg": 349.0988
    }
  ],
  "quality": {
    "rmse_m": 0.0544,
    "hw_time_err_p95_min": 13.26,
    "grade": "A",
    "validated_against": "IOC cor2",
    "grade_reason": "cumple todos los umbrales de grade A",
    "metrics": {
      "window_start": "2026-07-29T00:00:00Z",
      "window_days": 30.0,
      "samples": 43176,
      "predicted_range_m": 3.8494,
      "rmse_m": 0.0544,
      "nrmse": 0.01414,
      "r2": 0.99625,
      "hw_time_err_p95_min": 13.26,
      "hw_height_err_p95_m": 0.1026,
      "matched_extremes": 116,
      "predicted_extremes": 116,
      "predicted_extremes_in_window": 116,
      "observed_extremes": 117,
      "extremes_usable": true,
      "cross_rmse_m": 0.0027,
      "cross_source": "la_coruna-830a-esp-uhslc_rq",
      "cross_rmse_worst_m": 0.0284,
      "cross_source_worst": "coruna2tg-cor-esp-cmems",
      "truncation_rms_m": 0.00971,
      "dropped_amplitude_m": 0.05096,
      "dropped_amplitude_fraction": 0.020296,
      "dropped_constituents": [
        "EP2",
        "MA2",
        "MB2",
        "3L2",
        "SGM",
        "R3",
        "MKS2",
        "T3",
        "MTM",
        "2MS6",
        "MSQM",
        "N4",
        "3N2",
        "S3",
        "2MO5",
        "2MK5"
      ],
      "observation_source": "IOC cor2"
    }
  }
}
