{
  "schema": "station/v1",
  "id": "es-gc-san-bartolome-de-tirajana",
  "name": "San Bartolomé de Tirajana",
  "lat": 27.7465,
  "lon": -15.6239,
  "timezone": "Atlantic/Canary",
  "datum": {
    "reference": "LAT",
    "msl_offset_m": 1.408
  },
  "source": {
    "primary": {
      "dataset": "TICON-4",
      "station_id": "las_palmas-217d-esp-uhslc_rq",
      "station_name": "Las Palmas",
      "lat": 28.133,
      "lon": -15.417,
      "distance_km": 47.541,
      "analysis_epoch": {
        "start": "1998-12-31",
        "end": "2017-12-31"
      },
      "license": "cc-by-4.0"
    },
    "fallback": [
      {
        "dataset": "TICON-4",
        "station_id": "pluz-pluz-esp-ieo",
        "station_name": "Pluz",
        "lat": 28.1467,
        "lon": -15.4076,
        "distance_km": 49.312,
        "analysis_epoch": {
          "start": "1997-12-31",
          "end": "2016-12-31"
        },
        "license": "cc-by-4.0"
      },
      {
        "dataset": "TICON-4",
        "station_id": "las_palmas-217-esp-uhslc_fd",
        "station_name": "Las Palmas",
        "lat": 28.148,
        "lon": -15.407,
        "distance_km": 49.468,
        "analysis_epoch": {
          "start": "2005-09-24",
          "end": "2024-09-24"
        },
        "license": "cc-by-4.0"
      },
      {
        "dataset": "TICON-4",
        "station_id": "las_palmas-217b-esp-uhslc_rq",
        "station_name": "Las Palmas",
        "lat": 28.1,
        "lon": -15.4,
        "distance_km": 45.044,
        "analysis_epoch": {
          "start": "1971-01-01",
          "end": "1983-05-17"
        },
        "license": "cc-by-4.0"
      },
      {
        "dataset": "TICON-4",
        "station_id": "las_palmas-217c-esp-uhslc_rq",
        "station_name": "Las Palmas",
        "lat": 28.1,
        "lon": -15.4,
        "distance_km": 45.044,
        "analysis_epoch": {
          "start": "1983-06-23",
          "end": "1991-12-31"
        },
        "license": "cc-by-4.0"
      },
      {
        "dataset": "TICON-4",
        "station_id": "las_palmas-217a-esp-uhslc_rq",
        "station_name": "Las Palmas",
        "lat": 28.1,
        "lon": -15.4,
        "distance_km": 45.044,
        "analysis_epoch": {
          "start": "1985-01-01",
          "end": "1991-12-31"
        },
        "license": "cc-by-4.0"
      },
      {
        "dataset": "TICON-4",
        "station_id": "laspalmastg-las-esp-cmems",
        "station_name": "Las Palmas",
        "lat": 28.141001,
        "lon": -15.412,
        "distance_km": 48.555,
        "analysis_epoch": {
          "start": "2006-08-07",
          "end": "2025-06-30"
        },
        "license": "cc-by-nc-4.0"
      }
    ],
    "dropped_constituents": [
      {
        "name": "SGM",
        "amplitude_m": 0.003065,
        "phase_deg": 28.7898
      },
      {
        "name": "3L2",
        "amplitude_m": 0.002705,
        "phase_deg": 145.6029
      },
      {
        "name": "3N2",
        "amplitude_m": 0.001482,
        "phase_deg": 75.733
      },
      {
        "name": "R3",
        "amplitude_m": 0.00107,
        "phase_deg": 163.453
      },
      {
        "name": "T3",
        "amplitude_m": 0.001043,
        "phase_deg": 328.1176
      },
      {
        "name": "N4",
        "amplitude_m": 0.000794,
        "phase_deg": 15.2956
      },
      {
        "name": "S3",
        "amplitude_m": 0.000703,
        "phase_deg": 340.6132
      },
      {
        "name": "MSQM",
        "amplitude_m": 0.000585,
        "phase_deg": 240.9311
      },
      {
        "name": "MTM",
        "amplitude_m": 0.000373,
        "phase_deg": 355.003
      },
      {
        "name": "2MK5",
        "amplitude_m": 0.000259,
        "phase_deg": 119.482
      },
      {
        "name": "2MO5",
        "amplitude_m": 5.9e-05,
        "phase_deg": 242.6682
      }
    ],
    "derived_at": "2026-08-29T08:00:28Z",
    "attribution": [
      {
        "name": "TICON-4",
        "url": "https://www.seanoe.org/data/00980/109129/",
        "license": "cc-by-4.0",
        "license_url": "https://creativecommons.org/licenses/by/4.0/",
        "role": "constantes armónicas"
      },
      {
        "name": "openwatersio/tide-database",
        "url": "https://github.com/openwatersio/tide-database",
        "license": "MIT (código) · licencia de origen por estación (datos)",
        "license_url": "https://github.com/openwatersio/tide-database/blob/main/LICENSE",
        "role": "agregación y normalización · huella sha256 del contenido 2bbba2f45b8b4408…"
      },
      {
        "name": "GeoNames",
        "url": "https://www.geonames.org/",
        "license": "cc-by-4.0",
        "license_url": "https://creativecommons.org/licenses/by/4.0/",
        "role": "catálogo de puertos: nombre del municipio y coordenadas de la dársena · huella sha256 del volcado e2aa4fa9e6801568…"
      }
    ]
  },
  "constituents": [
    {
      "name": "M2",
      "amplitude_m": 0.746979,
      "phase_deg": 27.8285
    },
    {
      "name": "N2",
      "amplitude_m": 0.154705,
      "phase_deg": 14.2009
    },
    {
      "name": "S2",
      "amplitude_m": 0.285495,
      "phase_deg": 52.381
    },
    {
      "name": "K2",
      "amplitude_m": 0.080413,
      "phase_deg": 48.7095
    },
    {
      "name": "2N2",
      "amplitude_m": 0.022178,
      "phase_deg": 359.1789
    },
    {
      "name": "S1",
      "amplitude_m": 0.004219,
      "phase_deg": 347.0339
    },
    {
      "name": "K1",
      "amplitude_m": 0.061375,
      "phase_deg": 40.3271
    },
    {
      "name": "P1",
      "amplitude_m": 0.017794,
      "phase_deg": 30.0834
    },
    {
      "name": "O1",
      "amplitude_m": 0.0482,
      "phase_deg": 293.3667
    },
    {
      "name": "Q1",
      "amplitude_m": 0.01556,
      "phase_deg": 241.3132
    },
    {
      "name": "M1",
      "amplitude_m": 0.001826,
      "phase_deg": 306.0026
    },
    {
      "name": "M4",
      "amplitude_m": 0.007168,
      "phase_deg": 115.9357
    },
    {
      "name": "MM",
      "amplitude_m": 0.003075,
      "phase_deg": 313.4183
    },
    {
      "name": "MF",
      "amplitude_m": 0.008584,
      "phase_deg": 7.7797
    },
    {
      "name": "SA",
      "amplitude_m": 0.042152,
      "phase_deg": 165.2698
    },
    {
      "name": "SSA",
      "amplitude_m": 0.013783,
      "phase_deg": 43.7277
    },
    {
      "name": "T2",
      "amplitude_m": 0.016507,
      "phase_deg": 55.6661
    },
    {
      "name": "J1",
      "amplitude_m": 0.002379,
      "phase_deg": 69.8127
    },
    {
      "name": "L2",
      "amplitude_m": 0.016672,
      "phase_deg": 37.3011
    },
    {
      "name": "R2",
      "amplitude_m": 0.004502,
      "phase_deg": 68.7867
    },
    {
      "name": "2Q1",
      "amplitude_m": 0.003113,
      "phase_deg": 195.9702
    },
    {
      "name": "MSF",
      "amplitude_m": 0.00246,
      "phase_deg": 25.7294
    },
    {
      "name": "EP2",
      "amplitude_m": 0.00711,
      "phase_deg": 324.9708
    },
    {
      "name": "M3",
      "amplitude_m": 0.004343,
      "phase_deg": 161.7235
    },
    {
      "name": "MU2",
      "amplitude_m": 0.029947,
      "phase_deg": 349.2235
    },
    {
      "name": "NU2",
      "amplitude_m": 0.029136,
      "phase_deg": 17.8055
    },
    {
      "name": "LAM2",
      "amplitude_m": 0.003995,
      "phase_deg": 17.5883
    },
    {
      "name": "MN4",
      "amplitude_m": 0.003202,
      "phase_deg": 68.4242
    },
    {
      "name": "MS4",
      "amplitude_m": 0.003724,
      "phase_deg": 180.8711
    },
    {
      "name": "MKS2",
      "amplitude_m": 0.002484,
      "phase_deg": 17.4182
    },
    {
      "name": "M6",
      "amplitude_m": 0.001252,
      "phase_deg": 321.4297
    },
    {
      "name": "M8",
      "amplitude_m": 0.000345,
      "phase_deg": 177.4828
    },
    {
      "name": "S4",
      "amplitude_m": 0.000877,
      "phase_deg": 280.2186
    },
    {
      "name": "OO1",
      "amplitude_m": 0.000703,
      "phase_deg": 147.3193
    },
    {
      "name": "MA2",
      "amplitude_m": 0.004499,
      "phase_deg": 121.2217
    },
    {
      "name": "MB2",
      "amplitude_m": 0.006528,
      "phase_deg": 101.7268
    },
    {
      "name": "RHO",
      "amplitude_m": 0.002686,
      "phase_deg": 250.5857
    },
    {
      "name": "2SM2",
      "amplitude_m": 0.00132,
      "phase_deg": 219.9883
    },
    {
      "name": "2MS6",
      "amplitude_m": 0.001923,
      "phase_deg": 20.8731
    }
  ],
  "quality": {
    "rmse_m": null,
    "hw_time_err_p95_min": null,
    "grade": "C",
    "validated_against": "sin observación propia: la predicción no se ha comprobado en este puerto",
    "grade_reason": "no alcanza B: el mareógrafo más cercano está a 47.5 km > 30 km",
    "estimated": true,
    "estimated_reason": "las constantes armónicas son las del mareógrafo `las_palmas-217d-esp-uhslc_rq`, a 47.5 km de la dársena, y no hay observaciones de este puerto con las que comprobar la predicción",
    "metrics": {
      "window_start": "2026-07-30T00:00:00Z",
      "window_days": 30.0,
      "samples": 0,
      "predicted_range_m": 2.5405,
      "rmse_m": null,
      "nrmse": null,
      "r2": null,
      "hw_time_err_p95_min": null,
      "hw_height_err_p95_m": null,
      "matched_extremes": 0,
      "predicted_extremes": 116,
      "predicted_extremes_in_window": 0,
      "observed_extremes": 0,
      "extremes_usable": false,
      "cross_rmse_m": null,
      "cross_source": null,
      "cross_rmse_worst_m": null,
      "cross_source_worst": null,
      "truncation_rms_m": 0.00272,
      "dropped_amplitude_m": 0.01214,
      "dropped_amplitude_fraction": 0.007245,
      "dropped_constituents": [
        "SGM",
        "3L2",
        "3N2",
        "R3",
        "T3",
        "N4",
        "S3",
        "MSQM",
        "MTM",
        "2MK5",
        "2MO5"
      ],
      "observation_source": null
    }
  }
}
